{
  "schemaVersion": 1,
  "screenId": "profile",
  "revision": "6b3f143007645be76c39aeb408ea57a4b8207d8f402ce2b4bb90043c56247e1a",
  "components": [
    {
      "id": "screen.content",
      "type": "LazyColumn",
      "props": {
        "spacing": "m",
        "padding": "m",
        "align": "Start"
      },
      "children": [
        {
          "id": "profile.title",
          "type": "Text",
          "props": {
            "text": "Профиль",
            "style": "ScreenTitle"
          }
        },
        {
          "id": "profile.header",
          "type": "ProfileHeader",
          "props": {
            "fullName": "Buyer",
            "email": "buyer@example.org",
            "phone": "+79991234567",
            "avatar": null
          }
        },
        {
          "id": "profile.orders",
          "type": "Button",
          "props": {
            "label": "Заказы",
            "actionId": "profile.orders.navigate",
            "style": "Primary",
            "enabled": true
          }
        },
        {
          "id": "profile.devices",
          "type": "Button",
          "props": {
            "label": "Устройства",
            "actionId": "profile.devices.navigate",
            "style": "Primary",
            "enabled": true
          }
        },
        {
          "id": "profile.form",
          "type": "Form",
          "props": {
            "formId": "profile",
            "title": "Изменить профиль",
            "submitAction": "profile.submit"
          },
          "children": [
            {
              "id": "profile.fullName",
              "type": "FormField",
              "props": {
                "fieldId": "profile.fullName",
                "label": "Имя",
                "input": "Text",
                "required": true,
                "readOnly": false,
                "maxLength": 255,
                "changeAction": "field.profile.fullName"
              }
            },
            {
              "id": "profile.phone",
              "type": "FormField",
              "props": {
                "fieldId": "profile.phone",
                "label": "Телефон",
                "input": "Phone",
                "required": true,
                "readOnly": false,
                "maxLength": 16,
                "changeAction": "field.profile.phone"
              }
            },
            {
              "id": "profile.save",
              "type": "Button",
              "props": {
                "label": "Сохранить",
                "actionId": "profile.submit",
                "style": "Primary",
                "enabled": true
              }
            }
          ]
        },
        {
          "id": "address.44444444-4444-4444-8444-444444444444",
          "type": "Text",
          "props": {
            "text": "Moscow, Light, 1, 2",
            "style": "Body"
          }
        },
        {
          "id": "profile.edit.button",
          "type": "Button",
          "props": {
            "label": "Редактировать профиль",
            "actionId": "profile.edit",
            "style": "Primary",
            "enabled": true
          }
        },
        {
          "id": "profile.pin.button",
          "type": "Button",
          "props": {
            "label": "Изменить PIN",
            "actionId": "profile.pin",
            "style": "Primary",
            "enabled": true
          }
        },
        {
          "id": "profile.biometric.button",
          "type": "Button",
          "props": {
            "label": "Биометрия",
            "actionId": "profile.biometric",
            "style": "Primary",
            "enabled": true
          }
        },
        {
          "id": "profile.logout.button",
          "type": "Button",
          "props": {
            "label": "Выйти",
            "actionId": "profile.logout",
            "style": "Primary",
            "enabled": true
          }
        }
      ]
    }
  ],
  "actions": [
    {
      "id": "screen.refresh",
      "type": "Refresh",
      "destination": {
        "screen": "profile"
      }
    },
    {
      "id": "profile.orders.navigate",
      "type": "Navigate",
      "destination": {
        "screen": "orders"
      }
    },
    {
      "id": "profile.devices.navigate",
      "type": "Navigate",
      "destination": {
        "screen": "devices"
      }
    },
    {
      "id": "profile.submit",
      "type": "SubmitForm",
      "formId": "profile"
    },
    {
      "id": "field.profile.fullName",
      "type": "UpdateField",
      "fieldId": "profile.fullName"
    },
    {
      "id": "field.profile.phone",
      "type": "UpdateField",
      "fieldId": "profile.phone"
    },
    {
      "id": "profile.edit",
      "type": "EditProfile"
    },
    {
      "id": "profile.pin",
      "type": "ChangePin"
    },
    {
      "id": "profile.biometric",
      "type": "ManageBiometric"
    },
    {
      "id": "profile.logout",
      "type": "Logout"
    }
  ],
  "state": {
    "authenticated": true,
    "fields": {
      "profile.fullName": "Buyer",
      "profile.phone": "+79991234567"
    },
    "cartItemsCount": 0
  },
  "metadata": {
    "title": "Профиль",
    "locale": "ru-RU",
    "accountId": "11111111-1111-4111-8111-111111111111",
    "partial": false
  }
}
