{
  "schemaVersion": 1,
  "screenId": "product",
  "revision": "689ed1fc97387ef3362b91dca178277b337468b4c7a5ae2d98e8f56550de53cb",
  "components": [
    {
      "id": "screen.content",
      "type": "LazyColumn",
      "props": {
        "spacing": "m",
        "padding": "m",
        "align": "Start"
      },
      "children": [
        {
          "id": "product.title",
          "type": "Text",
          "props": {
            "text": "Real lamp",
            "style": "ScreenTitle"
          }
        },
        {
          "id": "product.image.741672fcf407afb396409810371c2fed",
          "type": "Image",
          "props": {
            "source": "/images/products/lamp.png",
            "description": "Real lamp",
            "aspect": "Product"
          }
        },
        {
          "id": "product.price",
          "type": "Price",
          "props": {
            "amount": "50.01",
            "currency": "RUB"
          }
        },
        {
          "id": "product.description.0",
          "type": "Text",
          "props": {
            "text": "Warm light",
            "style": "Body"
          }
        },
        {
          "id": "product.rating",
          "type": "Text",
          "props": {
            "text": "Рейтинг: 4.5 · Отзывов: 2",
            "style": "Secondary"
          }
        },
        {
          "id": "product.stock",
          "type": "Text",
          "props": {
            "text": "В наличии: 9",
            "style": "Secondary"
          }
        },
        {
          "id": "product.quantity",
          "type": "QuantityStepper",
          "props": {
            "fieldId": "product.quantity",
            "value": 1,
            "min": 1,
            "max": 9,
            "actionId": "product.quantity.change",
            "enabled": true
          }
        },
        {
          "id": "product.buy",
          "type": "Button",
          "props": {
            "label": "В корзину",
            "actionId": "product.add",
            "style": "Primary",
            "enabled": true
          }
        }
      ]
    }
  ],
  "actions": [
    {
      "id": "screen.refresh",
      "type": "Refresh",
      "destination": {
        "screen": "product",
        "id": "22222222-2222-4222-8222-222222222222"
      }
    },
    {
      "id": "product.quantity.change",
      "type": "UpdateField",
      "fieldId": "product.quantity"
    },
    {
      "id": "product.add",
      "type": "AddToCart",
      "productId": "22222222-2222-4222-8222-222222222222",
      "quantityField": "product.quantity"
    }
  ],
  "state": {
    "authenticated": true,
    "fields": {
      "product.quantity": "1"
    },
    "cartItemsCount": 0
  },
  "metadata": {
    "title": "Товар",
    "locale": "ru-RU",
    "accountId": "11111111-1111-4111-8111-111111111111",
    "partial": false
  }
}
