{
  "schemaVersion": 1,
  "screenId": "orders",
  "revision": "268031da70565f35595ac9459405333634d3ac687107b154d27934b4088585f6",
  "components": [
    {
      "id": "screen.content",
      "type": "LazyColumn",
      "props": {
        "spacing": "m",
        "padding": "m",
        "align": "Start"
      },
      "children": [
        {
          "id": "orders.title",
          "type": "Text",
          "props": {
            "text": "История заказов",
            "style": "ScreenTitle"
          }
        },
        {
          "id": "orders.form",
          "type": "Form",
          "props": {
            "formId": "orders",
            "title": "Фильтр",
            "submitAction": "orders.submit"
          },
          "children": [
            {
              "id": "orders.status",
              "type": "FormField",
              "props": {
                "fieldId": "orders.status",
                "label": "Статус",
                "input": "Select",
                "required": false,
                "readOnly": false,
                "maxLength": 20,
                "options": [
                  {
                    "value": "",
                    "label": "Все"
                  },
                  {
                    "value": "CREATED",
                    "label": "CREATED"
                  },
                  {
                    "value": "PAID",
                    "label": "PAID"
                  },
                  {
                    "value": "ASSEMBLING",
                    "label": "ASSEMBLING"
                  },
                  {
                    "value": "DELIVERING",
                    "label": "DELIVERING"
                  },
                  {
                    "value": "COMPLETED",
                    "label": "COMPLETED"
                  },
                  {
                    "value": "CANCELLED",
                    "label": "CANCELLED"
                  }
                ],
                "changeAction": "field.orders.status"
              }
            },
            {
              "id": "orders.filter",
              "type": "Button",
              "props": {
                "label": "Применить",
                "actionId": "orders.submit",
                "style": "Primary",
                "enabled": true
              }
            }
          ]
        },
        {
          "id": "order.33333333-3333-4333-8333-333333333333",
          "type": "OrderCard",
          "props": {
            "orderId": "33333333-3333-4333-8333-333333333333",
            "number": 42,
            "status": "CREATED",
            "total": "100.02",
            "deliveryAddress": "Moscow, Light, 1",
            "paymentMethod": "ON_DELIVERY",
            "createdAt": "2026-10-18T10:00:00Z",
            "openAction": "order.33333333-3333-4333-8333-333333333333.open"
          }
        },
        {
          "id": "page.next",
          "type": "Button",
          "props": {
            "label": "Далее",
            "actionId": "page.next",
            "style": "Primary",
            "enabled": true
          }
        }
      ]
    }
  ],
  "actions": [
    {
      "id": "screen.refresh",
      "type": "Refresh",
      "destination": {
        "screen": "orders",
        "orders": {
          "page": 0,
          "size": 20
        }
      }
    },
    {
      "id": "orders.submit",
      "type": "SubmitForm",
      "formId": "orders"
    },
    {
      "id": "field.orders.status",
      "type": "UpdateField",
      "fieldId": "orders.status"
    },
    {
      "id": "order.33333333-3333-4333-8333-333333333333.open",
      "type": "OpenOrder",
      "orderId": "33333333-3333-4333-8333-333333333333"
    },
    {
      "id": "page.next",
      "type": "Navigate",
      "destination": {
        "screen": "orders",
        "orders": {
          "page": 1,
          "size": 20
        }
      }
    }
  ],
  "state": {
    "authenticated": true,
    "fields": {
      "orders.page": "0",
      "orders.size": "20",
      "orders.status": ""
    },
    "cartItemsCount": 0,
    "pagination": {
      "page": 0,
      "size": 20,
      "totalPages": 2,
      "totalItems": 21
    }
  },
  "metadata": {
    "title": "Заказы",
    "locale": "ru-RU",
    "accountId": "11111111-1111-4111-8111-111111111111",
    "partial": false
  }
}
