{
  "schemaVersion": 1,
  "screenId": "devices",
  "revision": "0191ca92ddf5a9312aa9b9f36a8ed2ee257fa23bf53c6ec3133788319c60c79f",
  "components": [
    {
      "id": "screen.content",
      "type": "LazyColumn",
      "props": {
        "spacing": "m",
        "padding": "m",
        "align": "Start"
      },
      "children": [
        {
          "id": "devices.title",
          "type": "Text",
          "props": {
            "text": "Устройства быстрого входа",
            "style": "ScreenTitle"
          }
        },
        {
          "id": "devices.empty",
          "type": "Empty",
          "props": {
            "title": "Нет устройств",
            "message": "Настройте PIN или биометрию на устройстве"
          }
        }
      ]
    }
  ],
  "actions": [
    {
      "id": "screen.refresh",
      "type": "Refresh",
      "destination": {
        "screen": "devices"
      }
    }
  ],
  "state": {
    "authenticated": true,
    "fields": {},
    "cartItemsCount": 0
  },
  "metadata": {
    "title": "Устройства",
    "locale": "ru-RU",
    "accountId": "3e53341d-252a-4d3c-8664-2f808ea1862c",
    "partial": false
  }
}
