{
  "schemaVersion": 1,
  "screenId": "order",
  "revision": "4f8dbda66b18c8213fc931623e19e3cbdc4d9d81fe8034392bac8517591f7e01",
  "components": [
    {
      "id": "screen.content",
      "type": "LazyColumn",
      "props": {
        "spacing": "m",
        "padding": "m",
        "align": "Start"
      },
      "children": [
        {
          "id": "order.title",
          "type": "Text",
          "props": {
            "text": "Заказ №145",
            "style": "ScreenTitle"
          }
        },
        {
          "id": "order.11100dbb-ee36-4535-9c71-8cf7a5ffae0d",
          "type": "OrderCard",
          "props": {
            "orderId": "11100dbb-ee36-4535-9c71-8cf7a5ffae0d",
            "number": 145,
            "status": "CANCELLED",
            "total": "0.20",
            "deliveryAddress": "Moscow, SDUI integration, 18, 2",
            "paymentMethod": "ON_DELIVERY",
            "createdAt": "2026-10-20T13:21:33.396818Z",
            "openAction": "order.11100dbb-ee36-4535-9c71-8cf7a5ffae0d.open"
          }
        },
        {
          "id": "order.address",
          "type": "Text",
          "props": {
            "text": "Moscow, SDUI integration, 18, 2",
            "style": "Body"
          }
        },
        {
          "id": "order.payment",
          "type": "Text",
          "props": {
            "text": "ON_DELIVERY",
            "style": "Secondary"
          }
        },
        {
          "id": "order.item.0271c915-2087-4b67-ad93-a2d1bf6cfc7c",
          "type": "Row",
          "props": {
            "spacing": "s",
            "padding": "none",
            "align": "Start"
          },
          "children": [
            {
              "id": "order.item.0271c915-2087-4b67-ad93-a2d1bf6cfc7c.name",
              "type": "Text",
              "props": {
                "text": "Reference product × 2",
                "style": "Body"
              }
            },
            {
              "id": "order.item.0271c915-2087-4b67-ad93-a2d1bf6cfc7c.price",
              "type": "Price",
              "props": {
                "amount": "0.10",
                "currency": "RUB"
              }
            }
          ]
        },
        {
          "id": "order.total",
          "type": "Price",
          "props": {
            "amount": "0.20",
            "currency": "RUB"
          }
        },
        {
          "id": "order.comment",
          "type": "Text",
          "props": {
            "text": "Task2 native adapter HTTP verification",
            "style": "Secondary"
          }
        }
      ]
    }
  ],
  "actions": [
    {
      "id": "screen.refresh",
      "type": "Refresh",
      "destination": {
        "screen": "order",
        "id": "11100dbb-ee36-4535-9c71-8cf7a5ffae0d"
      }
    },
    {
      "id": "order.11100dbb-ee36-4535-9c71-8cf7a5ffae0d.open",
      "type": "OpenOrder",
      "orderId": "11100dbb-ee36-4535-9c71-8cf7a5ffae0d"
    }
  ],
  "state": {
    "authenticated": true,
    "fields": {},
    "cartItemsCount": 0
  },
  "metadata": {
    "title": "Заказ",
    "locale": "ru-RU",
    "accountId": "3e53341d-252a-4d3c-8664-2f808ea1862c",
    "partial": false
  }
}
