{
  "schemaVersion": 1,
  "screenId": "devices",
  "revision": "768dc5840c341bb6f19e7fccc49a86c552058be524599cf65a1161a3e4896603",
  "components": [
    {
      "id": "screen.content",
      "type": "LazyColumn",
      "props": {
        "spacing": "m",
        "padding": "m",
        "align": "Start"
      },
      "children": [
        {
          "id": "devices.title",
          "type": "Text",
          "props": {
            "text": "Устройства быстрого входа",
            "style": "ScreenTitle"
          }
        },
        {
          "id": "device.e928ff44622479105cfb98a4",
          "type": "Column",
          "props": {
            "spacing": "s",
            "padding": "s",
            "align": "Start"
          },
          "children": [
            {
              "id": "device.e928ff44622479105cfb98a4.name",
              "type": "Text",
              "props": {
                "text": "Phone",
                "style": "Title"
              }
            },
            {
              "id": "device.e928ff44622479105cfb98a4.id",
              "type": "Text",
              "props": {
                "text": "test-device",
                "style": "Secondary"
              }
            },
            {
              "id": "device.e928ff44622479105cfb98a4.last",
              "type": "Text",
              "props": {
                "text": "pin · 2026-10-18T10:00:00Z",
                "style": "Secondary"
              }
            },
            {
              "id": "device.e928ff44622479105cfb98a4.button",
              "type": "Button",
              "props": {
                "label": "Отозвать",
                "actionId": "device.e928ff44622479105cfb98a4.revoke",
                "style": "Primary",
                "enabled": true
              }
            }
          ]
        },
        {
          "id": "device.d1212a289d4d37920d50e008",
          "type": "Column",
          "props": {
            "spacing": "s",
            "padding": "s",
            "align": "Start"
          },
          "children": [
            {
              "id": "device.d1212a289d4d37920d50e008.name",
              "type": "Text",
              "props": {
                "text": "Phone",
                "style": "Title"
              }
            },
            {
              "id": "device.d1212a289d4d37920d50e008.id",
              "type": "Text",
              "props": {
                "text": "test-device",
                "style": "Secondary"
              }
            },
            {
              "id": "device.d1212a289d4d37920d50e008.last",
              "type": "Text",
              "props": {
                "text": "biometric · 2026-10-18T10:00:00Z",
                "style": "Secondary"
              }
            },
            {
              "id": "device.d1212a289d4d37920d50e008.button",
              "type": "Button",
              "props": {
                "label": "Отозвать",
                "actionId": "device.d1212a289d4d37920d50e008.revoke",
                "style": "Primary",
                "enabled": true
              }
            }
          ]
        }
      ]
    }
  ],
  "actions": [
    {
      "id": "screen.refresh",
      "type": "Refresh",
      "destination": {
        "screen": "devices"
      }
    },
    {
      "id": "device.e928ff44622479105cfb98a4.revoke",
      "type": "RevokeDevice",
      "deviceId": "test-device",
      "deviceKind": "pin",
      "confirmation": {
        "title": "Отозвать устройство?",
        "message": "Phone",
        "confirmLabel": "Отозвать"
      }
    },
    {
      "id": "device.d1212a289d4d37920d50e008.revoke",
      "type": "RevokeDevice",
      "deviceId": "test-device",
      "deviceKind": "biometric",
      "confirmation": {
        "title": "Отозвать устройство?",
        "message": "Phone",
        "confirmLabel": "Отозвать"
      }
    }
  ],
  "state": {
    "authenticated": true,
    "fields": {},
    "cartItemsCount": 0
  },
  "metadata": {
    "title": "Устройства",
    "locale": "ru-RU",
    "accountId": "11111111-1111-4111-8111-111111111111",
    "partial": false
  }
}
