{
  "schemaVersion": 1,
  "screenId": "orders",
  "revision": "596a9f4c9a5ee1e9732b1db5a98d2dbf0ac248e0033e4759f854f05b7ea51778",
  "components": [
    {
      "id": "screen.content",
      "type": "LazyColumn",
      "props": {
        "spacing": "m",
        "padding": "m",
        "align": "Start"
      },
      "children": [
        {
          "id": "orders.title",
          "type": "Text",
          "props": {
            "text": "История заказов",
            "style": "ScreenTitle"
          }
        },
        {
          "id": "orders.form",
          "type": "Form",
          "props": {
            "formId": "orders",
            "title": "Фильтр",
            "submitAction": "orders.submit"
          },
          "children": [
            {
              "id": "orders.status",
              "type": "FormField",
              "props": {
                "fieldId": "orders.status",
                "label": "Статус",
                "input": "Select",
                "required": false,
                "readOnly": false,
                "maxLength": 20,
                "options": [
                  {
                    "value": "",
                    "label": "Все"
                  },
                  {
                    "value": "CREATED",
                    "label": "CREATED"
                  },
                  {
                    "value": "PAID",
                    "label": "PAID"
                  },
                  {
                    "value": "ASSEMBLING",
                    "label": "ASSEMBLING"
                  },
                  {
                    "value": "DELIVERING",
                    "label": "DELIVERING"
                  },
                  {
                    "value": "COMPLETED",
                    "label": "COMPLETED"
                  },
                  {
                    "value": "CANCELLED",
                    "label": "CANCELLED"
                  }
                ],
                "changeAction": "field.orders.status"
              }
            },
            {
              "id": "orders.filter",
              "type": "Button",
              "props": {
                "label": "Применить",
                "actionId": "orders.submit",
                "style": "Primary",
                "enabled": true
              }
            }
          ]
        },
        {
          "id": "order.6cd31259-fcba-4278-a17f-cf8f5175ab7a",
          "type": "OrderCard",
          "props": {
            "orderId": "6cd31259-fcba-4278-a17f-cf8f5175ab7a",
            "number": 119,
            "status": "CREATED",
            "total": "0.20",
            "deliveryAddress": "Moscow, SDUI integration, 18, 2",
            "paymentMethod": "ON_DELIVERY",
            "createdAt": "2026-10-18T06:15:16.931399Z",
            "openAction": "order.6cd31259-fcba-4278-a17f-cf8f5175ab7a.open"
          }
        }
      ]
    }
  ],
  "actions": [
    {
      "id": "screen.refresh",
      "type": "Refresh",
      "destination": {
        "screen": "orders",
        "orders": {
          "page": 0,
          "size": 20
        }
      }
    },
    {
      "id": "orders.submit",
      "type": "SubmitForm",
      "formId": "orders"
    },
    {
      "id": "field.orders.status",
      "type": "UpdateField",
      "fieldId": "orders.status"
    },
    {
      "id": "order.6cd31259-fcba-4278-a17f-cf8f5175ab7a.open",
      "type": "OpenOrder",
      "orderId": "6cd31259-fcba-4278-a17f-cf8f5175ab7a"
    }
  ],
  "state": {
    "authenticated": true,
    "fields": {
      "orders.page": "0",
      "orders.size": "20",
      "orders.status": ""
    },
    "cartItemsCount": 0,
    "pagination": {
      "page": 0,
      "size": 20,
      "totalPages": 1,
      "totalItems": 1
    }
  },
  "metadata": {
    "title": "Заказы",
    "locale": "ru-RU",
    "accountId": "00e831b3-5c58-4471-93ef-e03b9bf4cb07",
    "partial": false
  }
}
